"June 17, 2018",5.0,Achilleion Museum = WOW,Achilleion Museum kind of really surprised us . If you are on Corfu plse do not miss it . The inside and outside of the Achilleion Museum are very inpressive as the life of the princess . It may be ver busy with people but nevertheless a very good reason to check it out ! After the exit of Achilleion Museum the restaurant on the left side ahs an awesome view !
"June 16, 2018",4.0,Beautiful building and views,"I went here mostly because I heard they had a penny press machine (they don't anymore) but as a happy bonus, I love historical buildings- I'm a NT member. We had a hire car and got here around 4pm so it was lovely and quiet. The building does make you say 'wow' and the gardens and surrounding views make you want to take photos! The rooms and exhibits are a little disappointing although I'm not sure why, I think maybe the lack of them? Also, using the audio guide is simple but more time consuming than reading something, I used it for a few key bits I was interested in. There is a lovely courtyard with a bar bit but no tables or seats? Not my favoueute historical building but I would love to go to an event here like a wedding or masked ball, it would be stunning."
"June 15, 2018",4.0,Stunning views and location not long enough to warrant cost,"Myself and family really were looking forward to seeing this highlight of the island. We were on a family holiday staying in Sidari. We booked onto a coach tour which stopped at Achilleion Palace, Mouse island and Corfu town. This was the main attraction we wanted to see. On arrival we were told that we had 1 hour. There was a que to purchase our tickets 5 mins a que to get our handset 5 mins and a que to hand them back. Also a que for the toilet 5 mins. Realistically we had 40 mins to look around this stunning attraction which had cost 20 euros to get there and 8 euros each entry. Not worth the money! if you do go to this attraction try to get there under your own steam so that you can get the best experience."
"June 13, 2018",5.0,Magic palace,"Such a beautiful place. Perfect palace with spectacular view. Beautiful colors,statues and gardens. It helps you travel in another time and feel the vibes of the palace. Ticket cost 8€,this is the price with no guide. You can buy also with a guide and the price is 10€. Hope you will enjoy the walk in the palace.!"
"June 12, 2018",4.0,Great sculptures!,A nice place to visit to get to know some history. The palace (inside) it self is nothing special but the gardens and the sculptures are amazing. The big Achilles statue at the end of the garden is great.
"June 12, 2018",5.0,Stunning,"Well worth the visit great museum packed with history, artefacts, paintings and brilliant sculptures. Also has some stunning views from the palace and well maintained gardens. Parking with your car is limited so a walk will generally be required to get to Achilleion. Included in your entry fee will be an audio device (11 languages), however, you must have your passport with you and queues for the device are lengthy. A gift shop and an outside refreshment are also to be found here."
"June 12, 2018",5.0,Sisi's Palace,"This was the primary stop during our shore excursion, a wonderful building and experience through the museum and gardens. The Empress of Austria, Elisabeth of Bavaria, visited Corfu in 1888 and decided it was her favoured place to enjoy a vacation. History tells us, and a visit to Vienna will confirm, that the Empress liked beauty and she decided that her palace would be a beautiful building and gratify her admiration for Greece, its language and its culture. She had a fascination of the Greek hero, Achilles; the palace is named after him, there are paintings and statues throughout the building and his sculpture is the centrepiece in the gardens. Our guided tour was exceptional, you felt as if you were living history through gallery after gallery and the treasures displayed, the grand staircase, the gardens with their many wonderful statues and sculptures, the striking architecture of the building. The Empress was a frequent visitor until her assassination in 1899"
"June 11, 2018",5.0,Memorable visit and bus ride. Justifiably very popular.,"My wife and I visited this museum after taking an enjoyable ride on the number ten bus from Corfu town. Cost was €1.70 bought in advance. It was a zone B, pink zone, ticket, one way. We bought return singles also. The bus was about 20 minutes late and took about 25 minutes to get there along some very windy roads and hairpin bends. To return to Corfu use the same bus stop. The buses go one way past here. We arrived about 1140.  Entrance cost €8. There were a few tour parties but these were easily avoided.  The first room visited on the right, after the entrance hall, is the catholic chapel of the Empress Elisabeth, easily missed if you are not concentrating.  The staircase going up and down was spectacular.  The statues of dying Achilles and victorious Achilles in the garden were memorable.  Disappointing only part of the extensive gardens could be explored. The Empress had a way built from the palace to the sea which would have been impressive but, if this still exists, was impossible to visit.  There are WCs and a café.  The bus ride back was also a good experience,"
"June 11, 2018",5.0,"Beautiful palace and gardens, with sea views.",Don't miss this - a five star experience. A beautiful palace once occupied by the Empress of Austria.
"June 10, 2018",5.0,Astonishing place,"Not much inside, it is rather simple and unsophisticated, I was expecting more from a building that belonged to Sissi (Habsburg) but then again this showed how humbled she was and did not fill up the building with useless art and hopeless decorations. The real beauty of this place is the setting and the landscape. The gardens are splendid and impeccably maintained. The only comment that I have: It is crowded. My advice, consequently: go early, beat the traffic and the convoy of busses that will pour hundreds of tourists into the magnificent gardens every hour."
"June 10, 2018",5.0,Art and architecture from the Hapsburg empress,"Built by the empress of the Austro-Hungarian Empire, it was her homage to Greek architecture and the hero Achilles. The garden has views of the Mediterranean, and large marble sculptures. The inside is a work of art, with painted walls and ceilings, amazing bronze had rails and bronze window and door treatments. There is a self-paced audio tour you can take. It can be reached by car, or by the Blue Line of the hop on hop off bus - but you will have more time if you drive there. If you do not go, you will kick yourself for not going."
"June 8, 2018",5.0,Amazing,"5 euros well spent, we came here as part of a Thomas Cook excursion. Lovely place, very tranquil. Our guide Sophia told us all about the Villa and Museum. We learnt a lot and looking around the house and gardens were lovely. Would liked to have spent more time there but maybe next time"
"June 7, 2018",5.0,A palace fit for an Empress,"This impressive house is a jewel in Corfu's crown. While the architecture and design of the building exhibit features of ancient Greek ideas , it is the location and views which are memorable. The art exhibited , both paintings and sculptures, has historical significance. However the information provided about the person of Empress Elizabeth of Austria , her life and life style, brings this place into the context of 19 centuary European history. House and garden take about 1.5 hours to visit. 8 euro enterance fee includes an excellent audio guide."
"June 6, 2018",4.0,"Interesting site, a must when visiting Corfu!","Mesmerising statues with fantastic history!  Make sure to bring a form of ID either license etc so that you can be guided via a handheld radio. The reason for the ID is that many radios were stolen in the past and it’s a form of security ensuring they get them back at the end of the tour.  The radio has many different languages and you’re able to skip to different parts of the building/site if you’re in a hurry.  Suggestion is to visit late in the day during summer so that you’re not inundated with bus loads of tourists.  If you are hiring a car, be cautious of the tight roads on the way up to the castle which to be fair are indicative of most island roads visiting small towns."
"May 31, 2018",4.0,Mrs,Well worth a visit it has some interesting exhibits and the gardens are lovely and so are the views.
"May 30, 2018",3.0,Must-see on Corfu,"Being a bit disappointed in Corfu regarding the offer of Greek history, we were glad to be able to visit the Achilleion. The palace is beautiful, garden very nice and overall worth a visit. Nice trip to the palace, kind people and a happy wife because of Sisi-feelings. Positive feelings about this visit but I'm sure Italians would have done more with this historical place regarding maintenance and decoration."
"May 27, 2018",3.0,ok but not spectacular,It was good to see some history and to see where Prince Phillip grew up. It is only the ground floor you see through. Not suitable for people with walking difficulties or pushchairs a lot of steps outside.
"May 26, 2018",4.0,Beautiful sculptures in garden,We enjoyed our two hour visit. Nice house with some lovely art and furniture. The garden is quite large with some very impressive sculptures. Achilles sculpture spectacular. Be careful and go out designated exit as the ticket taker is wicked and will make you go around.
"May 24, 2018",5.0,This is Real History,Visiting this Palace/Museum was a wonderful way to go back into history of the region and understand how much can be learned from a visit like this.
"May 24, 2018",5.0,A must see!,"This is a must see, well worth the effort. The Museum has an audio guide system, however if you go make sure you take two forms of ID, a passport and a driving licence or the staff won’t let you have a guide, we like so many others got caught out! Also worth note is the taverna on the left of the exit, the views are stunning and the coffee is pretty good as well."
"May 21, 2018",2.0,Only if you have time left,"Not worth the effort, very kitschy place. Tickets were quite expensive. Only nice thing is the garden with the views and the bronze achilles statue. Building itself is utter kitsch."
"May 21, 2018",5.0,A must see if in Corfu,Built by Elisabeth Empress of Austria this is an important historic building that has been restored with beautiful gardens and exceptional statues inspired by Greek mythology.  The huge statue of Achilles (for which the palace is named) is on the highest terrace and should not be missed. From here you get spectacular views towards Corfu town.
"May 18, 2018",5.0,A must-visit on Corfu!,"I had no idea of this palace's existence prior to arriving to the gorgeous island of Kerkyra. I found out about it through our accommodation's landlady's recommendation of which I am highly grateful to her.  Entrance ticket was affordable and for a student it was even less. There was a bunch to see and the audioguides, which where included in the ticket price, were extremely convenient. Amount of information was vast, but still easily digestable  Strong recommendation also for non-history buffs!"
"May 18, 2018",5.0,Nice place,It is very nice place with beautiful story and outstanding views. I would also recommend the coffee a bit further down (turn left from exit and walk about 20m) with very nice views and good coffee.
"May 17, 2018",5.0,Wow,We visited on a very hot day where views of the island around where unbelievable. Especially by the giant statute. Inside contains some lovely artifacts and decore. The cafe has a lovely seating area which is a must for photos.
"May 16, 2018",4.0,A must see,A place to visit during your stay in Corfu.It takes you back in the history during the governance if Queen Elizabeth where you can witness her daily life and experience.
"May 15, 2018",3.0,Lots to say here,"In 2018- 8 Euros for an adult and 6 if you are over 65. About 3k from the little town of Benitses.  You can walk there from Benitses (40 mins) or pay 10 Euros in a taxi. Big free car park for hirers.  I would say this place is well worth a visit however the draw back in my opinion is the endless arrival of tour buses with a tour guide whisking 60 plus people each time through the building and gardens. It's like a slow moving stampede.  As Annie and I were just two we were pushed and swept aside by the Germans the French and the English bus tours that arrived who had only twenty or so minutes before they had to move on, it was furious.  The experience was not a good one for us but the palace is truly beautiful and I think there needs to be limited number tours offered after hours like they do in the Basilica in Venice.One really needs time to absorb the sheer opulance of the place.  We took a few photos and Annie commented on the gigantic bronze of Achilles whom she said had buns of steel!  The immediate area is not that well serviced by real traditional Greek cafes and the Thai waitress who said all there was available was ham and cheese rolls kind of left us feeling a little robbed.  We walked back to Benitses (40 mins) and caught the 16.40 bus back to the hotel. (1.80 each, The Marbella) (20 Euros from the hotel to the Palace if you're mad enough to pay)  Beware walking on the roads. Always walk on the side the traffic is approaching you so you can see what's going on. Cars,buses and lorries move very fast and you need to be very aware at all times. Be safe and enjoy the trip!"
"May 14, 2018",5.0,Achilles spear,"This should be visited at least once. The whole place both inside and outside are terrific. The views are astounding and the statue of Achilles has to be seen to be believed. The painting at the top of the staircase was breathtaking but really, the view from the garden makes it unmissable."
"May 12, 2018",3.0,Interesting attraction.........But !!,An amazing building but unfortunately our guide completely overwhelmed us with historical detailed information which detracted from the visit. The adjacent cafe however had amazing views and was worth a visit.
"May 11, 2018",2.0,Not worth the money.,"Paid for handheld guide outside but then demanded ID inside which we did not have. No option to pay a deposit. Very let down, blight whole visit. Not a lot to see anyway."
"May 10, 2018",4.0,Bring original passport/drivers license/id if you want the audio,"Great place to visit. Impressed with the architecture of the palace, the paintings and murals as well as the beautiful gardens and statues. Very happy I paid €8 entrance fee which included the audio guide. It provided me with plenty of information I otherwise would have missed out on. Bit of a saga to get the audio guide as you have to join the line which can be quite long and you do need an original piece of ID which they keep till you return the audio guide.... joining the line again to do so. You can keep them for 1 hr so they say, we walked around far longer with them, no problem. I did see an elevator inside the palace but better get proper info re wheelchair use etc from the source, it did not look particularly wheelchair or pram friendly to me. Cafe and toilets on premises. Without the audio guide entrance is $2 I think."
"May 4, 2018",1.0,Ridiculous,"The procedure for getting an audio guide is simply ridiculous. After waiting in front of the entrance and paying 8€, you have to wait much longer inside to get an audio guide and you will definitely need it, because there are hardly any written explanations! The staff is completely overchallenged and has to write down lots of personal data and takes your passport or drivers licence as deposit (just for an indifferent audio guide...)! Furthermore you can use the audio guide for just one hour, which is way too short, if you are interested in the exhibition. Thereafter you have to wait again to bring back the audio guide and get back your ID. A really unsatisfying experience."
"April 16, 2018",4.0,Great place to visit,We spent a great few hours here. It's an impressive house with stunning terrace and gardens. And a giant bronze statue of Achilles. What more could you want?
"April 14, 2018",3.0,Interesting but was it worth it?,"Went there by blue bus No. 10, €1.7 each. Paid €16 for us to look inside. Little there in the house. House decoration nice and looked very promising but failed to materialise with furniture. Gardens very nice. Had drink, then walked down hill to the sea shore/coast. Turned right to go to Benitses beach. Had meal there and caught blue bus No 6 back home. Great day but felt the cost of Achilleion a bit too expensive."
"April 8, 2018",3.0,Interesting but not worth to go there just for it,Interesting place with some historical interest and some art pieces. Not worth to go there just to visit it.
"April 1, 2018",4.0,Nice museum,"It was lovely march morning with amazing architecture, nice paintings, park and building. Unfortunately it was the first place there were lots of tourists. Worth to come, nice historical place. Great pics from that place. Plan less than one hour."
"March 29, 2018",5.0,Sissi’s Palace,"We thoroughly enjoyed our visit to Sissi’s Palace. How much better can it get than standing in a vast hillside palace garden looking out on the beautiful Aegean Sea? We were only on the island of Corfu for a day during a Princess Cruise stop, but it is certainly a place I dream of returning for a longer stay. Having previously visited Bavaria and Austria on another trip, we were vaguely familiar with Sissi (Empress of Austria) and the story of the tragic assignation in 1898 in Switzerland. Built in 1890, the palace seems much older because of its classical Greek features. The opulent palace abounds with paintings and statues of Achilles depicting the heroic and tragic scenes of the Trojan War. The popularity of the Achilleion Palace also comes from the fact that a famous James Bond film “For Your Eyes Only” was shot at the palace in 1980."
"March 27, 2018",5.0,An Inclusive Museum,"While not my first trip to the Island (or indeed to Greece), the Achilleion has nonetheless been on my short list for a number of years (and was definitely worth the wait!).  An architectural gem, set amongst the olive groves of Gastouri in the Corfu countryside, (10 kilometres south of Corfu Town). The site was the brainchild of Empress Elisabeth (also known as Sisi) lover of all things Greek, who used it for summer retreats. The grounds and the building, therefore, are dedicated to the myths and legends of Greece, none more so than the Hero Achilles and his actions during the Trojan War (so a must for any student of History).  Some of the works on display in the Museum include Franz von Matsch's The Triumph of Achilles and the giant ceiling painting created by Italian painter Vincenzo Gallopp, (both of which are worth seeing). but the highlight is outside in the grounds... Achilles as 'guardian of the palace' that stands proudly in the grounds, (Kaiser Wilhelm II's contribution to the Achilleion) and the subject of many a postcard over the years.  The site also boasts walled gardens and views over the countryside (which on a clear day you can see the flags fluttering over the old Fort in Corfu Town). However, for me as a disabled traveller the highlight, in the end, was the admission. Unlike any other museum, I have been to in Greece, the concessions (which usually apply only to students and seniors) applies to disabled persons too, for which admission is free! (if you have a valid card on your person). A wonderful inclusive step (which includes wheelchair access and audio guides), otherwise, admission is €15.00 (non-concession)  If you do not have a car, the museum is fairly easy to find, the Number 10, (conveniently called Achilleion) from Corfu Town (2 mins walk from the main bus station) at a cost of just €1.50 each way! The trip takes about 25 Mins, in which you take in some breath-taking views of the island. My advice, go late in the day (3 hours before closing) less crowded with day-trippers and finish by watching the sunset over the palace."
"March 3, 2018",5.0,Nice,"Its very nice place and interesting part of history. I suggest anyone should go and see it. It takes few hours, but its says a lot of Sisi’s life and style."
"February 20, 2018",5.0,Beautiful residence of Empress Elizabeth,We were 4 times on Corfu island but visited 3 times Achilleon... It is really beautiful - mostly for those who feels what Sissy meant to Hungarians... However - the museum is more than wonderfull :))
"February 16, 2018",5.0,Summer holiday day trip,We decided to do a day tour around Corfu island and this was part of it amazing architecture outside of building and even better inside this is a must to see that also filmed casino royal here the outside grounds are beautiful and scenery breathtaking also they have the statue of Achilles outside this country is steeped in history and a must when visiting to go out and about and learn some of the history would definetly recommended people to visit here
"February 5, 2018",5.0,Not just James Bond,"The Achillion Palce is fascinating. Not only was it where many parts of the Bond movie were filmed but the history is very interesting. Take time to read about the history before visiting because this will increase your enjoyment. If it’s not busy when you go, you must lie down at the entrance and take a photo of the stunning fresco. The only way to photograph it is from floor level. The huge statue of Achilleas dominates the beautiful gardens and there is also a statue of Achilleas with the arrow through his ankle. Then of course you will see the statues and pillars featured in the Bond movie For Your Eyes Only filmed in 1981. It’s a shame that people who visit Corfu don’t check out the history because it’s amazing and opens up the island in a way you wouldn’t imagine. I do think going round the Achillion with a guide is best. Go, savour and enjoy."
"February 4, 2018",4.0,Great Museum,"Decided one afternoon to walk up the huge 2 mile hill from our hotel (Aeolos Beach Resort) to visit Achilleion Palace Museum. Got to the top of the hill, paid our entrance fee and then went to hire the headphones with audio so we knew where to go and the history of the palace only to be told because we had no passports with us we couldn't hire them. We even offered to leave a deposit so they knew we would return the headphones but the woman wouldn't budge. That spoilt our visit a bit as all the information boards were in Spanish. Beautiful place and grounds, well worth a visit but please remember your I.D. if you want to hire the headphones and discover the history of the place. Found out some really interesting history on the board as we were leaving, that would have been better at the start of the tour so we could have had a bit of a clue as to what we were looking at."
"January 22, 2018",5.0,fantastic,one of the most beautifull places in corfu you can spend an hour in the museum and the gardens are magnificent
"January 18, 2018",4.0,Achilleion,Nice and interesting. We had a good guide: Grațian. He told us a lot of things about this place. I liked it so much.Before I didn't know much about it.
"January 7, 2018",5.0,Don't Leave Corfu without Seeing It,"I missed The Achilleion last time but saw it from the back of a scooter at night, thanks to a kind Greek airline employee who took me into town to my hotel. For those who are interested in Empress Elisabeth of Austria and her interest in the Greek classics, it is a must. The grounds are gorgeous, as is the statuary, especially the big one of the mansion's namesake. Wonderful artwork and wall paintings."
"January 7, 2018",4.0,Beautiful,"The Achillion is a stunning place, worth several hours of wandering. When we got there it was late in the afternoon, and not wanting to drive Corfu's 'fun' roads in the dark we did not get to spend as much time as we would have liked.  Many of Corfu's sights are linked to Elizabeth's family, so this is worth a visit to set the scene.  The gardens are lovely, some of the sites are stunning. Some areas are off limits such as the wooded area where Eizabeth would walk and there were objects linked to her family.  Sadly, the Achillion was turned into a casino prior to becoming a museum and this is evident in places. Still, it is enjoyable and worth a visit."
"January 3, 2018",5.0,back into time with an emperesse,if you go to corfu you have to see this palace gives a vieuw of all the wealth they( the austrians) had in that time
"December 31, 2017",5.0,Superb palace and gardens,"If you visit just one historic site on the island of Corfu, make it this one. Everything about the place is breathtaking - the palace, its history, the gardens, the statues, and the views. It's worth taking the audio guide, but you'll need your passport for it.  We were lucky when we visited as the place was almost empty. A different experience when its full of coach parties, I suspect."
"December 13, 2017",5.0,Beautiful Palace,This was the palace of Empress Elisabeth of Austria and Kaiser William II of Germany. It is exquisite. Beautiful building and gardens full of bougainvillea. Inside gives you history of the place and many of the furnishings.
"November 30, 2017",4.0,Lovely place to stroll,Beautiful summer palace with lovely grounds and gardens. Not very busy and easy to navigate. Enjoyed having a coffee on the veranda.
"November 27, 2017",4.0,Visit to Achillion,Very interesting lovely place to look around. Stunning views and enjoyed learning about Corfu and history
