"November 5, 2018",3.0,Limited interest but a nice stop for a bus/walk,"We went to the palace on the red bus which was well sign-posted and easy to find. The palace itself is imposing but inside is very disappointing unless you are really interested in the German royal family! The collection seems a bit random, bits and pieces they have found, no real continuity linking the pieces. The grounds are small and dominated by a number of over-sized statues of achilles. That's it basically. There is a small cafe but next door is a private cafe with great views, and the owner makes the best apple pie! The best part of the trip was to take the tour bus back a couple of stops, cross the bridge on foot and then walk back into Corfu Town along the coast road.You get an entirely different perspective of the town away from the tourist old quarter."
"November 1, 2018",5.0,GRAND TOUR OF CORFU,"We visited the palace as part of a tour that we had booked , our guide on the tour accompanied us and gave a very interesting commentary on the palace. Without a guide it would not have been so enjoyable. The gardens and views were amazing as was the palace, would love to revisit."
"October 31, 2018",4.0,Flash pad,This is a very nice place to visit and can appreciate that on a clear day the view would be spectacular. The house is large and well set out. The audio guide was worth listening to at most sites. The scuptures in the garden were larger than life.
"October 31, 2018",3.0,"Worth seeing, but could be so much more","What truly makes this place stand out is the exterior. The mansion itself is stunning and the views and gardens and statuary are spectacular.  On the downside, as mentioned in other reviews, is the interior. For one thing, the crowds were so bad that there were some rooms we couldn't even get into and just weren't worth the wait. And then, once you got into the rooms, there was often not much there. Or, if there was something to see, it was poorly marked/labeled so you didn't really know what you were looking at.  We were lucky in that we had a guide for much of the time and so were able to at least get some of the history and the context behind the place, its history and inhabitants. We also got a little more info about some of the specific objects inside the mansion.  But there was very little information actually posted anywhere so, if you had no guide or did not have the audio, there was no way to know what you were looking at or its significance.  I thought it was interesting to see and worth the trip but I think it has the potential to be so much more. I would definitely recommend having a guide or using the audio-guide (which we did not use, so can't comment on how good it is) so that you at least have some context for what you are seeing."
"October 31, 2018",4.0,A great view and gardens,"As with others, the interior was not as expected. The UK National Trust could help this site significantly with management of parking, visitor numbers, interior decor and furniture and general displays.  The fact that the palace is built up the side of a hill needs to be explained so that the lack of rooms at each level makes sense. The staircase, small chapel and the hall on the top of the hill are the rooms of note that are open to the public. The audio guides take forever to get with deposit of ID and an age to return - you are only allowed 1 hour use!  The gardens and the views across Kerkyra (Corfu town) are spectacular and are alone worth the visit. The statues of Achilles are truly beautiful to behold."
"October 25, 2018",3.0,Worth a visit,"It's a beautiful palace, though I found the inside a little disappointing. The interior was smaller than I thought it would be. The highlight for me was definitely the gardens. I loved the large statues and the views were wonderful. We didn't visit the cafe and I wished they were more souvenirs in the gif tshop."
"October 23, 2018",5.0,James Bond in Corfu.,This amazing place was used in the Bond film For Your Eyes Only and is a stunning place to visit on it's own merits. Lots of history and stunning views. Cafe is useless though.
"October 23, 2018",3.0,Nice visit if you have lots of time in Corfu,All the locals recommended this palace as a must see and it was a bit disappointing to be honest. It is a beautiful palace but not very large and the interior is not very rich. There were crowds of people in most rooms so it was difficult to enjoy the palace. We drove there and parking was a nightmare- its a very long and narrow road to get to the palace with limited side street parking.  Recommend this place if you have lots of time to kill- otherwise wouldn't make this a priority to see in Corfu.
"October 22, 2018",4.0,Visit it in off season!,"Great sample of art deco mixed with pseudo antic greek😎 and lot of money. But it's worth to visit, just stay out of peak hrs in the tourist season, if your aim isn't to wait in line about 30'just to get in. A special Greek spirit add tickets - they are without numbers ,laminated for multiple use and are token away from visitor at entrance. Any bookkeeper or tax inspector should get a stroke instantly just seeing it 😎😋"
"October 18, 2018",3.0,Take ID if you want an audio guide!,"We visited mid-October and it was still quite busy with several coachloads of tourist, mostly arriving at 11-12 so best to arrive before or after. Entry for adults is 8 euros per adult which includes an audio guide. However, for some reason you have to provide photo ID, such as a driving licence or passport, which you have to use as a deposit, only getting it back when you return the audio guide. Why not just have someone collecting the audio guides at the exit gate instead of all that unnecessary faff? Also, as it didn’t state the requirement for ID ANYWHERE on their website, we didn’t have anything they accepted and so weren’t allowed an audio guide, even though I offered to leave a cash deposit. As there was hardly any written info about anything in the palace, we felt that the audio guide was a must and therefore really disappointing to have travelled there especially and paid our entry, only to be told about the ID requirement too late to do anything about it. Why, oh why not make this clear on the official website? When I raised this with the audio guide lady, she very curtly said she didn’t know about the website and I should talk to the manager. I tried to do this but was told he wasn’t available. So be warned. And hopefully someone who works at the Achilleion will actually read their reviews and feedback and act upon it."
"October 17, 2018",3.0,Nothing special,"Visited here whilst in Corfu as an attraction. Different and unique to see, a place to visit but wouldn’t return, as nothing special. €8 each entry fee. Nice gardens and cafe. Most of top floor is closed off to staff only. So only 1 floor to explore. Nice views from the gardens at top. Take camera. No signs or directions or where to collect audio gear for audio tour so missed out on that and made our own way around."
"October 16, 2018",5.0,Plenty to see,"Coped well with the coach parties. The Palace and garden are very interesting. The first owner ""Cissy"" was a caracter and a half. Sad the building is not in better repair though."
"October 15, 2018",5.0,Longed for trip,Revisiting again as the last time was 1973. Such an interesting place to view because of the history. Beautiful scenery from balconies.
"October 15, 2018",4.0,Palace and gardens are well worth visiting,"The blue city bus takes you to the palace cheaply.You do not need to go on the hop on and off unless you want to. For 5 euros you can buy a day ticket (on the bus) for any blue bus.The bus takes a different route to and from the palace. On Sundays there are fewer buses. We got off at Paranama on the way back which meant that we did not have to go back to Corfu town againThis is a busy attraction and you need to make sure that you give yourself enough time. It takes about 10-15 mins to queue for an audio tour - free and invaluable- and the same to return. The audio tour did allow you to better make sense of what you were looking at. My only gripe was the expectation that you should hand over your passport or driver's licence to get the gadget. I would have preferred to leave a monetary deposit as I do not think that one should hand over such valuable documents even if she was careful.Toilets were good and there were two sets, one on the left as you look at the building and the other set on the right which were clearly signed up. There can be a bit of a bunfight to get on the bus on the way back so be prepared"
"October 14, 2018",4.0,Worth a visit,We visited this as part of a coach tour. The gardens are beautiful with superb sculptures and a great view. Some interesting artefacts of the Hapsburg Empress Elizabeth who was assassinated. On her death the palace was sold to the last king of Prussia Kaiser Wilhelm2. Again there are many of his possessions and photographs on show. The palace was used in the Bond film for your eyes only. Entry prices seemed reasonable.
"October 12, 2018",4.0,Beautiful Palace and Gardens,Great views back towards Corfu Town from the upper gardens. Very interesting artefacts throughout the palace from the time of Princess Elizabeth of Austria and then Kaiser Bill. Gardens are well maintained (unlike Mon Repos) Was very busy when we were there and there was only one person handling the Audio guides which made for a long queue.
"October 10, 2018",5.0,The most beautiful palace I have ever visited!,"The Achilleion Palace, built for and owned by the Empress of Austria and Queen of Hungary Elisabeth, also known as Sisi on a top of a hill, surrounded by forest and gardens and looking to the Corfu Town and the Mediterranean see is a magnificent place. The building is beautiful, there are maybe hundreds of statues, sculptures and pictures both outdoors and inside the palace. Greek mythology is well represented, including two major statues of Achilles, who also has given the name to the palace. So many unique pieces of art, so beautiful views, such a special atmosphere!"
"October 9, 2018",4.0,Interesting history.,"Built by Elisabeth Queen of Hungary in 1889 and sold in 1907 to Kaiser Wilhelm 11. There are the remains of a bridge over the main road to the sea (Kaiser Bridge) it was bombed during the war. I was disappointed by the general condition of the property, run down and in need of maintenance."
"October 9, 2018",5.0,a must visit !,A beautiful palace and most amazing gardens built by the Austria Hungarian royalty family . Don't miss a visit there .
"October 8, 2018",3.0,Could be better!,"As with so much in this region, the house - particularly the exterior - leaves much room for improvement. Whilst the architecture itself is not great, the grounds are really quite disappointing. In particular there needs to be judicious thinning and re-planting of the trees in order to restore the views that must have existed originally.  Probably better to visit in the middle of the day when most of the coach parties have departed...."
"October 8, 2018",5.0,Great castle,Nice surprise with documented history and story. Wonderful gardens and surrounding with so many spots to take a picture and enjoy. Take the handcuffs and listen some details about family history.
"October 6, 2018",3.0,Historical experience,"The old palace of Sissy is unique and full of history! The audioguide is included in the price but the lady at the counter was really rude and unpolite, not a good customer service."
"October 6, 2018",4.0,An hour to explore wasn't enough.,"It was an extremely interesting view into how the European royal families were interlinked. (Prince Philip was born just a few miles away). Austro-Hungarian grandeur mixed with Italianate designs. Well worth visiting just for the artwork, particularly that of ancient Greek history,especially Achilles, after whom the palace was named. A huge statue of him in the garden, a famous one of him trying in vain to pull the poisoned arow from his heel, and an enormous painting of him at Troy. Quite a way out of town, but on the hop on hop off city tour bus route."
"October 5, 2018",5.0,A visit we had been planning,This is an amazing place opulence at its best my hubby and I do lots of walking. We stayed at Corfu Holiday Palice Hotel. It’s Central for walking and crossed the causeway then turned left. Road isn’t great but when you get to sign for Alexandros Hotel turn right. Just walk (about 45 minutes from hotel). Water is required!
"October 3, 2018",4.0,Beautiful House in Stunning Location,"Enjoyed our visit to this lovely house, views were spectacular and the guide was great filling us in with the History. Do not expect to see a house full of antiques it is quite empty, but would still recommend the visit."
"October 3, 2018",3.0,Quite interesting,"It is worth a visit to see all the bling and decorations, but is very much orientated towards German visitors. The gardens were rather disappointing."
"October 2, 2018",4.0,Lovely house.,"This is a beautiful house which is well worth a visit. Did this with a tui excursion, book with Olympus travel in town, same excursion and a lot cheaper, disgusting mark up by Tui."
"September 30, 2018",4.0,Worth a visit,The views from the garden were absolutely stunning. Majestic building with visible history. Not in the best condition though. Overall loved walking around the site and well worth the (small) entrance fee.
"September 30, 2018",4.0,Interesting Palace if I knew what i was looking at!,Our visit was unfortunately marred by the fact that they had run out of audio guides so we had no idea what we were looking at during our visit. Had to research when i got back to the hotel and wifi - wish i had the advantage of the information while we were there. It is a beautiful property with an interesting history. Well preserved and worth the visit - but maybe research before you attend in case they run out of radio guides again.
"September 30, 2018",3.0,"Ok, bad condition",The villa is in a very bad condition (like everything in Corfu). Very poor interior. Second floor is not open for visitors. Really pity
"September 29, 2018",5.0,Majestic and yet little for Royal standards,"A beautiful, large house with about 50 rooms. Built by Empress Elizabeth of Austria (Sissi), construction completed in 1889, year of the suicide of her son. It would be bought by the Kaiser. The theme of the house is Achilles. Two statues of him Achilles dying of the empress; Kaiser's triumphant Achilles. Dark furniture from the empress;light furniture of the Kaiser. Two tragic personalities, opposed and united by the ownership of this property"
"September 27, 2018",4.0,Nice to do; great views,"Built by Elizabeth, Empress of Austria, this was her Corfu retreat. She was assassinated by Italian separatists (can’t remember when) and the house was acquired by Kaiser Wilhelm - so bears much of his influence. It’s not a grand place, but it was a pleasing visit, the gardens giving great views over Corfu. Entry is 8 euros ....6 for EU citizens over 65 so that little discount won’t be troubling Brits after Brexit...unless of course there’s a break out of sanity and we ditch the whole dumb idea and throw Boris and Michael Gove in the Tower for lies to the British people and subversion of our democracy. There’s a free audio guide available - but an original photo ID is required..so original passport or driving licence. The numbered stops for the audio seem a tad random and easy to miss, but that’s all part of the fun. Accessible from Corfu town on a number 10 bus (about 25 mins journey, some of it along a steeply climbing road with hair pin bends) . I don’t know the return journey cost, probably about 3 Euros, but if you’re coming in by bus from somewhere else a handy tip is to get a 5 Euro day ticket that gives unlimited travel on the blue buses. Be aware that the bus can get very crowded....standing room only on both out and return legs of the journey, and it’s not that frequent so best check the timetable for both out and return. On the return there’s an irritating 2 hour gap between the 15.30 and the next and penultimate return at 17.30. I think the taxi will charge 20 Euros!I’d describe this as a nice-to-do for those who like this sort of thing...probably not so great for families with kids who would prefer to be on the beach."
"September 25, 2018",5.0,What a interesting place to visit and great views from gardens,A really interesting place to visit .had the tour with guide and it was very very interesting information .Built in 1889-1891 by the empress of austria and her story was very interesting .GO and find about the whole story YOU will enjoy .
"September 25, 2018",4.0,Best attraction on the island,"This is one not to miss. The Palace has an interesting history and a great view from the gardens, which has some impressive statues. It gets very busy especially if there are a number of cruise ships into the island, we were only allowed the audio headset for 50 mins so it felt a little rushed. So we wandered around the grounds afterwards. Don't expect too much furniture in the palace, but it's certainly one not to miss."
"September 25, 2018",5.0,Very beautiful place,"Very beautiful place, worth to visit. We arrived by car, it was not easy to find a parking place. The palace has a beautiful view to the ireland and to the sea."
"September 23, 2018",5.0,Wow: Amazing place with amazing history/ sights,"First stop on my grand tour of Corfu. The palace is a lovely building with interesting history, artefacts and amazing views. I enjoyed my visit but would have liked to spend longer than the 1 hour my tour allowed."
"September 23, 2018",4.0,Stunning views - stunning building,"We fancied seeing more of the island. On looking up on trip advisor we decided on this place. Up some twisty roads you finally get to the location ontop of one of the hills. Parking was free, we decided on parking along the road side as some people decided to dump their cars on the little carpark making it hard for others to get on and off. Paid €8 Each. Friendly Staff on the gate to direct you. Once inside you can collect your FREE audio device with id such as driving licence or passport. What was good we managed to hire 4 sets under one ID. Only complaints were that we were only given a hour to use the audio device (longer was needed) we found ourselves rushing around and missing the front garden area. Once upstairs there were no audio guide on what rooms you were in which was very disappointing. Be useful a number on entering the room to tell you what the room was used as. Some stunning sights and the views from the garden were amazing. Toilets nice and clean, good access around the palace. There are lifts for anyone who Can't manage the stairs. Was good value for the money especially if you use the free audio guide."
"September 20, 2018",4.0,Achilleion Museum a must when visiting Corfu!,Not visiting the Achilleion is like not visiting the Acropolis in Athens. A must to your visit to Corfu.
"September 20, 2018",4.0,Beautiful Palace. Photo I D required.,"First and foremost, if you visit here take photo I D as without it you will not be able to get the audio guide which is included in the price of the ticket. This was the only element which marred an otherwise lovely visit to a beautiful and interesting place. You can easily get here from Corfu town on public transport and by so doing will save a significant amount of money!"
"September 19, 2018",4.0,Not to miss in Corfu,"If you like a bit of history - you must see this place. Indeed passport or ID is needed to get English guide, but you would check that before you visit. I found it very interesting. Beautiful place."
"September 18, 2018",5.0,Excellent museum/house to explore,We had a great afternoon at the Achilleion. We went by Corfu bus (No 10) from the centre which runs hourly but can also be reached by car or the hop on/off bus. Set on a hill outside Corfu their are wonderful views back to Corfu Town and the coast. The audio guides make for an informative and interesting tour of the house and gardens (lasts about an hour). The statue of Achilles is great!
"September 18, 2018",4.0,Lovely Evening Excursion for good value,"We came up to the Achilleion at around 5pm and had a lovely couple of hours at the museum. The ceiling and stairwell art work is beautiful, but my favourite part was the courtyard with statues of the muses, where there is a cafe to enjoy a refreshment, and the impressive statue of Achilles which overlooks a beautiful view of Corfu. The tickets cost €8 per adult and I think this was good value."
"September 18, 2018",3.0,Beautifull park with views.,Achilleion is a neo classistic chateau opposite Mon Repos in god condition. Perhaps the german imperor is more belowed than the former king of greece. The palace it self is not a master piece. But there is af beautifull collection of statues. Mostly i will recommend the beautifull park close to the sea..
"September 17, 2018",4.0,Worth visiting if in the area,"This is a really interesting place to visit, the tour goes into the long history and the artwork is amazing.The gardens have some magnificent statues to see and fabulous views.There are toilet facilities, souvenirs and cafe facilities on site."
"September 16, 2018",4.0,"iWas there, finding art, Achilles and the shadow of Sisi","narrow roads, free parking but tough to find, crowded place - but is is a must to visit in Corfu nice place built for a nice lady, the Empress - in respect to local culture, the mark of the place is Achilles, the Trojan hero art, gardens, flowers and nice views over the sea and the island rest for a while and have a coffee , enrich your eyes with those imperial places - it's true that a certain moment that mansion served as a casino, but nowadays the place regained it's glamour"
"September 15, 2018",3.0,Day trip to visit,"We saw is on the way to the hotel and decided to pay it a visit. To be honest it is nothing more than a Victorian Foley, a bit of a nothing really, once a hotel then a casino now a musem of sorts, worth a look, but nothing special"
"September 15, 2018",5.0,Top in the top,"It is at the top of a hill not far from Corfu. The view is extraordinary in many directions, especially from the upper level terrace. It has some interesting paintings and only a few of the old furniture are kept. It's worth visiting"
"September 15, 2018",1.0,Save your money!,"If you are interested in getting squashed between busloads of tourists in the rooms of this palace, go for it! If not, save your money. Commercial exploitation at it’s worst. Terrible…"
"September 15, 2018",5.0,Busy but worth going,"Be prepared for just how crazy this place gets, particularly if you're driving and not on a coach. The place is fantastic though, with beautiful grounds that you can spend a whole day in so take snacks with you, as the restaurants nearby are really touristy."
"September 15, 2018",4.0,Achilles Palace,"Beautiful art and amazing history, set in the mountains close to the centre of Benitses. Guided tour for 15 Euros, lovely afternoon out"
"September 14, 2018",5.0,A beautiful palace,This was an interesting and beautiful palace. We only needed an hour there but glad we went. Good views as well as audio tours. There were fine frescoes and the price was reasonable.
"September 13, 2018",4.0,Very beautiful castle,It's a very nice castle and well maintained. Not too crowded. A challenging drive up there with some bisses crossing the narrow roads but worth it!
"September 12, 2018",3.0,SO promising but left me feeling a bit vacant. Like the house.,"The architectural elegance is undeniable and the front facade is extremely welcoming. After getting my recorded English guide to the number plates in each room, I was hopeful of what was to come. I love history and Sissy is of course, one of the great tragedies of the era. She was an icon of her time and stunningly beautiful, married the highest man in the land and was wealthy beyond reason. She HAD this house built-it was HERS. So it was a surprise to me that the first couple of rooms had some religious items which I didn't particularly find intersting. Then it was disappointing. Room after room was empty bar a few display cabinets with some references to her but literally, looked like the place had been gutted, pillaged or ransacked at one time or another. The gardens were lovely and looked after. The things they couldn't remove, such as that view to Corfu town, thankfully have been permanently fixed the place and so worth it for that. Views to Albania, inspiring. Views north to the highest point on the island, invigorating. The story of the bench/balcony where she mourned the death of her son, very moving. There are little treasured moments to be found here, but you must allow for the time to mine them out."
"September 10, 2018",3.0,Disappointing,"From my research about this place before my holiday I had thought that I could spend hours here in the gardens. Sadly, that is not the case. The gardens are actually very small and I was told that the best time to visit is Spring as when I was there it was September and the flowers were not at their best. The view is quite good. The museum - not so much."
