"September 27, 2022",5.0,Incredible Sights!,We took the walk from Aeleos Beach Resort the Achilleion late one afternoon knowing that the museum was partially closed but still wanted to see what remained open. Its a difficult trek on foot actually so wear suitable shoes if you are walking there. Once there it is clear that there is substantial work going on to the property and that there is only a limited view of the gardens available. As a huge fan of Greek mythology i was disappointed but knew already that there was limited access. The gardens themselves are pretty and the view of Corfu town and the coast is incredible! Literally something from a Bond film. The two major statues of Achilles are actually much more impressive in person in both size and detail. I would love to return here once it reopens fully.
"September 27, 2022",3.0,Major renovation underway,"Much appreciated by German speakers due to this being built on behalf of “Sissy” of the Austro Hungarian empire, who has taken on a mythical reputation, ending in her demise in Geneva. The building is undergoing total renovation, presumably having been neglected for a sustained period. The only bit open is part of the modest garden. A few statues have been renovated. Parking along the street. Entrance 5 euros."
"September 25, 2022",3.0,"Not now, maybe later","Extended re-furbishing works are in progress, so interior of the palace is not opened for visitors and most of outdoors exhibits are also surrounded by scaffolding. Probably in 2023 or even later the place would look totally different than now. Gorgeous view of the surrounding landscape at the end of the garden (towards the sea)."
"September 19, 2022",3.0,We have to come back when it is re-opened,"The interior is not accessible due to refurbishing works, which also affect the exterior. The main garden is lovely."
"September 7, 2022",3.0,Palace visit,"It was OK, the Palace is being refurbished at present so you can only go in the gardens. Fabulous views. It was really busy while we were there. Worth a visit at €5 per person."
"August 18, 2022",2.0,Abandoned,So abandoned that is so pity.. I have visited some years ago and now is in worse condition:-( So pity
"August 18, 2022",3.0,15 min walk outdoor,Nice history and wonderful location. Only 2 stars as the interiors are under complex restoration work with a hand of people ( no more agitation to conclude the work soon). There are not provided info about the location and no curator in place. They can do more at that location. Tickets are expensive for just outdoor walking.
"July 23, 2022",5.0,Cool place,Amazing garden with fantastic views.only the museum it was at under construction.Cool pictures and Achileon it's my favorite place.
"July 13, 2022",3.0,"Lovely place, but take care of planned restoration works","Be aware, as per the venues website there is major restoration work on going.  Google translate of the website front page:  From 1/6/2022 to 30/9/2022 the imperial gardens of the Achilles Museum will be open to the public. Opening hours: daily: 8:00 - 20:00 Due to upgrading and restoration work, the interior of the Museum will remain closed. Read more here"
"July 10, 2022",2.0,Waste of time and money...,"Waste of time and 6 euros - The whole building is under major renovation with NO internal access of any kind. Waste of time driving all the way to see a scaffolding display. The gardens are not even fully open and it only takes 5 mins to walk around the part that is open, total rip off for 6 euros each - not recommended to visit."
"June 21, 2022",5.0,achillion palace,wonderful museum with impressive artifacts and decorations. early morning is recomended for a visit to avoid large groups.
"May 28, 2022",1.0,Website misleading......,"This was on our to do list while in Corfu and we checked out the website before making the drive there to make sure of opening times, etc. Told us it would be closed from 1 June to Sept, 2022 for refurbishment and that the gardens were open for visitors regardless. Sadly, both those statements were incorrect. Not only was the house already closed (had been for a while) but the gardens were also closed, so a wasted trip, annoyingly. Wish some of these places would get their info correct on their websites so wasted journeys are not made and time wasted! Judging by the numbers of cars there, plus people trying to get in - and coaches (!!) - it would appear we were not the only ones with a wasted trip...."
"May 5, 2022",5.0,Time machine,"We visited this villa several times - because one visit is not enough. It is a pity that there is no space for presentation and other stories besides this official one - the building used, during its history, as villa for noblemen, military hospital, orphan institution, casino and, an the end, - as museum."
"December 26, 2021",5.0,Beautiful Palace and Gardens,"Our final stop on our HAL tour was the village of Gastouri, where we visited Achilleion Palace, the mansion built by Empress Elisabeth of Austria and later owned by Kaiser Wilhelm II. It is wonderful inside and has beautiful gardens and statues. It was by far our most interesting stop on our tour.. The gardens are beautiful. The two most important statues are both of Achillies (Achillies in his prime and the dying Achllies). And there is a great view from the garden. The German sculptor Ernst Herter was commissioned to create works inspired from Greek mythology. His sculpture Dying Achilles, created in Berlin in 1884 as inscribed in the statue, forms the centrepiece of the Achilleion Gardens. German Kaiser Wilhelm II purchased Achilleion in 1907 and he commissioned his own Achilles statue from the sculptor Johannes Götz who created an imposing bronze sculpture that stands as guardian of the gardens, facing north toward the city."
"December 4, 2021",4.0,Visit in museum,This place doesn’t have a lot to offer. Outside the palace were some building works. Museum has a lot of history inside. It is great to see that people takie care of such kind things.
"November 17, 2021",3.0,Crowded,"This site does have lots of history, however we visited on a day with cruise ships and it was jammed pack inside. The outside is nice with feature statures and a somewhat view of Old Town. Displays are a bit tired and some with better descriptions. Museum is worn and tired. Only can view downstairs."
"November 16, 2021",1.0,Beware: Selling tickets though closed!,"When I arrived by public transportation, I was told it was closed. However, the website says it is open, and is selling tickets online. Also, the front of the entrance said it was open, and every Google search I did before arriving, including this one, said it was open as well. What a disappointment to see it closed. Had to wait two hours in the rain for the next bus back to Corfu. When I asked the front entrance employees why they don’t update their website to state it is closed, and noted how it is an inconvenience for people to make their way to the site, only to find it closed, then have to wait two hours for the next bus, I was told rather bluntly, “It’s not my problem.” No, it isn’t, but it’s a poor reflection of the way the place is being run…especially since it’s still selling tickets online! Good luck in getting your money back. The place doesn’t even deserve one star…and it’s still selling tickets online."
"November 3, 2021",5.0,Amazing view,"Did not know what to expect, walked there from our hotel and was surprised to see many coaches and lots of visitors. Vaccination certificate required to enter. Well worth a visit."
"October 27, 2021",2.0,Not really worth the entry fee,"So disappointed with our visit. Two adults, two teenagers & a 7yr old cost us €36. We were there for about 15min tops as all the top floors were closed and there really wasn’t much to see. All the nice items are actually posted on here😅. We drove 2km down a winding path for a lovely lunch near the water though, so probably plan for that first as many of the lunch places, besides basic sandwiches, are still closed."
"October 26, 2021",3.0,"Beautiful building and gardens, but a lack of information and lots closed off for the 10€ entry price","The palace itself is beautiful and grand, and you cannot view the outside fully without buying a ticket. It's wonderful to look at (despite the aging, which I like - I don't expect to see it as pristine as it originally would have been) but once inside only the bottom floor is open.  There is an information board outside, brief leaflets inside (they had no English ones left unfortunately, but plenty of other languages available), but limited information other than that. There are small plagues with brief descriptions near items, but they are vague and don't even have dates to know which period they are from. All in all, it doesn't take long to get around the bottom floor.  The gardens are beautiful and you get to see the statues of Achilles and a great view over to Corfu Old Town. Otherwise there is not much else to see in the whole place. Even if you can't see anymore inside, it'd be nice to be able to explore the grounds more as they head down toward the beach. There is building work being done so maybe they are planning on opening more of the building up to the public, but they should reduce the price in the meantime."
"October 25, 2021",3.0,A fading memory of better times,"The museum is small and not of much interest. The garden, however, is lovely. With the house, in need of some TLC, this is likely more of interest to ladies of a certain age. Don't take the kids."
"October 21, 2021",3.0,Great sight,"This is a palace build for the Austrian empress sisi. The entrance fee of 10 Euro giving u access to the ground floor of the mansion and the garden. It is a bit sad to see, that preservation works are not really gone that far, the mansion and the garden have seen better times."
"October 19, 2021",2.0,Very sad visit,"I have never seen a building in such a state of dilapidation . One is only aware that the building is being renovated when one arrives at the ticket office. The only floor which is open is the ground floor with very little explanation- the paintings have been taken off the walls and there is no indication which room is which. In fact Sissy only visited this summer house twice a year during eight years - just before she was unfortunately assassinated. The gardens and the exterior of the house are in a deplorable state and the only thing worth seeing is the view over to Corfu town, the famous ceiling in the hallway. and the statues of Achille. It is a real sad state of affairs that the Greek gouvernement can Allie this to happen."
"October 14, 2021",2.0,The gardens were nice but the palace was very limited.,"This felt like a safe experience, visitors were asked to provide proof of Covid vacation before entering.  Upon entering it looks impressive however there was construction being carried out on the upper levels.  The palace was underwhelming as only the ground floor was available and this was limited in what it offered. Some of the Empresses dresses and some old furniture.  The history of the palace is given to visitors in a pamphlet to read and gain some insight into the building.  Due to the constitution the exit from the garden was closed which means walking back through the gardens which is still nice but be aware there are many steps and stairs and no alternative for those who may need one.  There were several people throughout the garden cleaning and restoring some of the statues and garden ornaments which I'm sure will look great when completed."
"October 13, 2021",2.0,Only ground floor accessible to guests.,This isn't worth the money. Be aware you will only be able to see the bottom floor of the palace museum which is rather small and the objects on display aren't interesting at all. They do not make people aware of this before entering and by this point you've already paid. I wouldn't recommend.
"October 1, 2021",5.0,Remarkable place,A remarkable place that takes you back in time. I hope one day people will take care of the statues and the building. Will visit again.
"September 29, 2021",2.0,Stressful,"Not a great experience for us, not prepared for the extremely narrow road up to the museum and did not realise massive tour buses and local busses go up there and literally force you off the road with nowhere to go. The museum is not filled with any Sisi artifacts, instead some stuffy costumes of Maria Callas and some photos of Kaiser Wilhelm and others. Nothing is explained well and yes, upstairs is closed of course. The outside of the buildings are derilict and the trees now so tall and not cut back at all, no sea views from the terrace. Were dreading to go back the same windy, narrow road. Very stressful experience! My advice - avoid driving up there unless very early in the morning. Don't bother going up there if you are hoping for some original Sisi furniture or clothing. or photos."
"September 18, 2021",3.0,Bit of a rip off!,Low rating because they charged us the full entry price of €10 despite only being open on the ground floor. Upstairs they are restoring. Gardens open and it was very nice but they should only be charging half price for that. You need to show your covid vaccine proof for entry too which some people weren't aware of.
"September 18, 2021",2.0,Currently not good value,"Currently not worth the entrance fee! I would like to have written a positive review but given the cost of 10 euros I cannot! The history of this place really intereted me andi was aware there would be floors closed off but I expected the floor on view to be impressive. Why not at least have photos of the grand interiors and information about the work being done? The gardens must have been lovely in their day and the views great but it felt uncared for. I am sure it is a matter of staffing and cost but the National Trust manage such renovation times so well. I will continue to use the net to research this property. I learnt so !little from this visit! A lovely building but not a lot for the fee. If you go, arriving at about 9 was fine. After that, so many tour groups made it less pleasant."
"September 12, 2021",4.0,Historical Corfu Gem,"So glad we made the effort to make it out to the palace. About 20 minutes and a taxi from the old town. A beautiful building with a wonderful history. A shame about the building work that was being carried out, but still worth the trip"
"September 9, 2021",3.0,Spoilt by the building work,Only giving 3 stars as most of the property and top level of the grounds are closed due to renovation.  £10 Euros for 5 rooms and a well manicured country estate garden a bit steep think there should be a discount whilst it's being worked on .  Anyway the grounds are great lots of photo opportunities remaking James bond scenes .  Not that busy for a sunny Thursday afternoon was able to take photos and stroll through the grounds pretty much to out selves .  Parking easy lots of free roadside or large parking a short stroll away .  Is it worth a visit yes historic importance just a shame about the renovations
"September 8, 2021",5.0,"Views, gardens, memorabilia & apple pie - lovely!","Beautiful views, gardens and interior, a lovely couple of hours. Happy to pay €10 each to contribute towards the upkeep of such a lovely place. The gardens and views across to Corfu Town, bay and airport were the highlight for us. Only the ground floor of the museum is currently open, but fascinating memorabilia of Kaiser Wilhelm and an exhibition about Maria Callas were interesting. We visited on our last day in Corfu, before heading to the airport (15 mins away) and it was a perfect visit, the gardens in the sunshine were beautiful and not crowded. We finished up at the Bella Vista cafe (just down the hill to the right of the museum) - recommend their delicious apple pie & lemonade on their terrace."
"September 2, 2021",3.0,Overpriced!,It’s beautiful but you’re not allowed 1 photo per person in front of the main staircase. That’s what they told us after we paid €10 each to enter.  There are more beautiful places that are free to enter in London!
"August 28, 2021",2.0,"Partially closed, not worth the trip","There are extensive repairs going on at the moment, not before time as the building is not in a good state of repair, so only the ground floor is available to view. The views over the bay from the are good but on the whole it’s not a very interesting place to visit. We got no sense of the life lived in the building, we moved from room to room without it capturing our imagination"
"August 23, 2021",2.0,Expensive and partially closed,"Monday 23rd August we drove from our accommodation in Barbati to visit this former Palce. We were advised by a local Taverna owner that here was a place to see.  We parked up in the free car park and climbed an exhausting number steps up to where the old palace, now Museum is located.  Frankly we were shocked to see that the entrance fee was €10, especially when there was a sign advising visitors that sections of the building were closed or refurbishment and repairs.  We thought we would not bother with the museum, seemed to bit of a rip off, but would have a stroll through the gardens so we walked in through the gates. We were soon followed by a lady shouting ""ticket ticket"" we asked if we had to pay to visit the gardens, yes full entrance fee. We promptly left.  There were a number of organised tour coaches parked up outside, dread to think how much they paid for the experience."
"August 20, 2021",5.0,"""Loyal"" environment",Great location. Amazing statues of Achilleas. The palace has many exhibits. The garden is also very nice.
"August 18, 2021",4.0,Achilleon Palace visit,"I recommend making your own way by bus to this attraction, as this worked well allowing us to spend what time we wanted to there. Part of the exterior was closed off during our visit for ongoing renovation. It was not expensive to get in and overall an enjoyable visit. There is a distillery opposite, free to visit, which is worth calling in to sample the local liquor. We spent about two hours there in total and covered everything."
"August 7, 2021",4.0,Palace and gardens were gorgeous,A definite must when on Corfu This belonged to the Empress of the Austrio-Hungarian Empire in the late 19th century. It is well maintained and architecturally displays what can be done when money is unlimited. The only dissapointment was that you are limited to the first floor. There are four plus I assume a k8tchen and cellerb which are not on display
"August 1, 2021",5.0,Worth to visit - we'll go again,Very exciting museum in beautiful surroundings. Even though its undergoing renovation there were many things to see and we really enjoyed it :-)
"July 20, 2021",2.0,The destruction continues.,"At the moment, it is not possible to rate highly. ""Renovation"" in progress 3/4 of the building is excluded from viewing, for 10 € for a ticket for 20 minutes of sightseeing, it is very poor. Pictures and objects are indescribable. No work is in progress but you cannot go to that rooms that could be better used are occupied by an unrelated exhibition about Maria Callas. Everything is decaying, fungus on the wall. The longer I visit Corfu, the more I am convinced that the inhabitants do not care what they got. They're more interested in taking the parking fee."
"July 18, 2021",4.0,"The Achellion Palace - hard to access, but worth a visit.","This attraction is in an isolated area. If you go with a tour company, they charge an absurd amount of money, and basically, you’re paying the tour outfit for a ride to/from the palace. Far better value to take the #10 bus from the central square in the city. You can purchase tickets either from the clearly marked ticket /information kiosk in the square or from the driver onboard. The cost is 1.5 euros in each direction, and the tricky thing is that the boarding venue is 200m from the main square. The Palace is the final stop, and the ride takes 20 minutes going, and 30 minutes on the return. The Palace only takes 45 minutes to tour, and it’s crucial to know that buses return from the Palace to Corfu at 12.20, 2.50, and 5.20, so plan the bus from Corfu accordingly, so you don’t get stuck at the Palace, waiting 2 hours for the return. I recommend going early in the day, both because of the heat, but also, because the big tour buses come in the afternoon. The admission in 10 euros, 8 for those over 65. The garden in the back of the palace is lovely, and the piece de resistance is the sculpture of the death of Achilles. Due to renovation inside, only the ground floor is currently open."
"July 18, 2021",4.0,A place filled with history,"Great place if you're looking for some history of the place! I was fascinated by this spot and enjoyed spending some good quality time there. The disadvantage was that we only were allowed to visit the ground floor because the others are in full renovation. However, it's a must-see if you're ever in need of something else!"
"July 13, 2021",5.0,"Beautiful palace, amazing surroundings","We have visited Achilleion even though the latest reviews were rather negative. The ongoing construction works affecting the 1st floor are certainly a disadvantage (and so is also the fact that the entire place need further refurbishment and maintenance) but still, the place is beautiful and is well worth a visit. It is full of history and works of art (from paintings to beautiful sculptures and amazing pieces of furniture, beautiful fire places and an amazing central staircase). The outside gardens, sculptures and the views to Corfu Town and around are amazing. A place not to be missed if you want to taste also a little history and art, apart from the sea and sun."
"July 11, 2021",1.0,Don't waste your time,"Don't waste your time, there is much better place to see in Corfu Island. We visited The Achillion Palace on 10.07.2021, basically everything under construction, access to few room of the Palace - very poor exhibitions. We finished in 10 min our visit. Nice view from the garden. Entrance fee 10€. Not recommended."
"July 10, 2021",2.0,Still requires plenty of TLC!!,"My wife and myself are currently holidaying in Benitses (staying at the recently opened Angsana Corfu Hotel - Review to follow) and this afternoon decided to go to the nearby Achillion Museum/Palace pay to see if things had improved since our last visit some 3 years ago (see previous Review).  Unfortunately, it quickly became clear on arrival that much of the property was unavailable due to ongoing refurbishment so we decided to delay our return visit until next year. Hopefully by then there will have been a significant improvement as this is potentially a first-class attraction!!"
"July 8, 2021",3.0,"A little disappointed, but it is open (July 2021)","I was a little disappointed. The building itself needs attention (it is getting it). Only the one floor is set up as a museum and it was moderately interesting. The grounds have good views (but they are easy to get in Corfu!), but you cannot walk far. At least it's open after COVID!"
"July 7, 2021",5.0,"ARISTOCRACY,PHILOSOFY,MYTHOLOGY AND ELEGANCE","Even if are made some works of resauration ,the places vizuted are impresive Built by SISSY,,emperatrice of AUSTRO-HUNGARY,after the deth of his son,the 2level palace is sorrounded by brautiful gardens and ornated with statues of ACHILEAS,the greek hero,of APOLO with the 9 muzes and the 3 graces and of philosofers The main staircase inside is remarcable as so as the portrets of the imperatrice"
"July 1, 2021",2.0,Requires some refurbishing …,"Nice property and garden but is not worth the 10 euro entrance , in particular due to the fact that this palace requires major renovation works. Also the staff at the entrance (both at the ticketting desk and at the entrance check) were really unfriendly. The only time we met such attitude in our whole stay in Corfu …"
"June 29, 2021",5.0,sisy's palace,"Very well preserved historical building now works as museum. inspired from greek mythology, is surrounded by statues and gardens with panoramic view of ionian sea."
"June 18, 2021",4.0,"Yes, they are open","As opposed to what tripadvisor writes, this place is NOT temporarily closed! The beautiful gardens and the ground floor are open to visitors, only the upper floor is closed for renovation purposes. We went there today and enjoyed the grounds, the statues etc. Inside, well it’s like most palaces."
"November 15, 2020",5.0,Beautiful palace with a fascinating history,Beautiful palace with a fascinating history! From Sisi to Weilheim to Casino to hospital no wonder it’s possibly lost many of its prize possessions. The gardens and views are amazing. Check out the James Bond connection and the really quirky cafe (with a terrace filled with unusual collection of old machines and tools including half an old VW camper van!) opposite. Of course we were ‘lucky’ to avoid coach load of tourists (during COVID hit quiet season).
"November 1, 2020",5.0,Spectacular view of Corfu town,"When we came here last time, 40 years ago, it was still a Casino. Now a museum, really worth getting the audio tour. Be aware that you have to leave your Passport or Driver’s License as security."
"October 23, 2020",5.0,Beautiful house and gardens,"Beautiful palace and extensive grounds. It gets horribly busy in high season with coach loads of people visiting, but at quieter times it is fantastic. Lots of steps so not for the faint hearted!"
